"Disease","OPCS4code","OPCS4codeDescr","Incl_Cat"
"Anorectal fistula","H55.1","Laying open of low anal fistula","Procedure for Anorectal fistula"
"Anorectal fistula","H55.2","Laying open of high anal fistula","Procedure for Anorectal fistula"
"Anorectal fistula","H55.3","Laying open of anal fistula NEC","Procedure for Anorectal fistula"
"Anorectal fistula","H55.4","Insertion of seton into high anal fistula and partial laying open of track HFQ","Procedure for Anorectal fistula"
"Anorectal fistula","H55.5","Fistulography of anal fistula","Procedure for Anorectal fistula"
"Anorectal fistula","H55.6","Probing of perineal fistula","Procedure for Anorectal fistula"
"Anorectal fistula","H55.7","Repair of anal fistula using plug","Procedure for Anorectal fistula"
